<?xml version="1.0" encoding="UTF-8" ?>
<!DOCTYPE dissertation SYSTEM "dissertation.dtd">
<dissertation 
	created="2003-06-25 12:04:39" 
	status="manuscript" 
	fulltext="missing" 
	thesis-type="monography" 
	modified="2003-09-19 13:55:06">
  <id>ts12m</id>
  <record-source>
    <name>Scripta Academica Lundensis</name>
    <linkage>ts12m</linkage>
  </record-source>
  <creator>
    <name>
      <last>anl.12m</last>
      <first>anf.12m</first>
    </name>
    <born>ayob.12m</born>
    <electronic-address>ae.12m</electronic-address>
    <affiliation>
      <name>ac.lth</name>
      <name-hierarchy></name-hierarchy>
      <electronic-address>aahp.12m</electronic-address>
      <postal-address>aapa.12m</postal-address>
    </affiliation>
  </creator>
  <date-issued>
  </date-issued>
  <title>t.12m</title>
  <pages>nop.12m</pages>
  <language>sv</language>
  <availability>
    <available>
      <linkage>
      </linkage>
      <series-title>aadist.12m</series-title>
      <coden>aadiui.12m</coden>
    </available>
    <medium>
    </medium>
    <distributor>
      <name>aaddnoo.12m</name>
      <electronic-address>aadde.12m</electronic-address>
      <postal-address>aaddpa.12m</postal-address>
    </distributor>
  </availability>
  <summary-in-english>sie.12m</summary-in-english>
  <summary-in-swedish>sis.12m</summary-in-swedish>
  <uncontrolled-terms>
    <uterm>kk.12m</uterm>
    <uterm></uterm>
    <uterm></uterm>
    <uterm></uterm>
    <uterm></uterm>
    <uterm></uterm>
  </uncontrolled-terms>
  <controlled-terms>
    <cterm>S192</cterm>
  </controlled-terms>
  <term-paths>
    <cterm-path>
    </cterm-path>
  </term-paths>
  <umi-term>0729</umi-term>
  <supervisor>
    <name>
      <last>snl.12m</last>
      <first>snf.12m</first>
    </name>
    <affiliation>
      <name>sanoo.12m</name>
    </affiliation>
  </supervisor>
  <defended>
    <date>ded.12m</date>
    <time>det.12m</time>
    <location>del.12m</location>
    <external-examiner>
      <name>
        <last>deeenl.12m</last>
        <first>deeenf.12m</first>
      </name>
      <affiliation>
        <name>deeeanoo.12m</name>
      </affiliation>
    </external-examiner>
  </defended>
  <funded-by>
    <name></name>
  </funded-by>
</dissertation>
